### ISSUE TITLE
channel/bridge record

### ISSUE THREAD

**Issue by rperre** [greenfieldtech-nirs/phpari#38]
Hi,
I'm trying to record a call (by recording a channel or a bridge).
I use channels()->channel_record("channelid","file.wav","wav",60,1)
and I get "false" as a result. 
Can anyone help?

**Comment by rperre** [comment]
I have debuged with curl and it was getting a error about the fileformat, I've solved that problem by adding support to asterisk.

Now i have nother problem:

I start a bridge recording and I get a positive result:
  ["name"]=>
  string(5) "debug"
  ["format"]=>
  string(3) "sln"
  ["state"]=>
  string(6) "queued"
  ["target_uri"]=>
  string(22) "bridge:5:1:433|5:2:434"

but when try to stop and save it I get "false" again.
when debuging with curl i get:

# curl -v -u xxxx:xxxxx -X POST "http://localhost:8088/ari/recordings/live/debug/stop"
{
  "message": "Recording not found"
* Closing connection #0
}

any help?
thanks

**Comment by greenfieldtech-nirs** [comment]
Hi Ricardo,

   Can you please paste a full wireshark trace?


Kind Regards,

  Nir Simionovich

  GreenfieldTech

  (schedule) http://nirsimionovich.appointy.com/

  (w) http://www.greenfieldtech.net

  (p) +972-73-2557799        (MSN): nirs@greenfieldtech.net

  (m) +972-54-6982826      (GTALK): nir.simionovich@gmail.com

  (f) +972-73-2557202      (SKYPE): greenfieldtech.nir


----------------------------------------------------------

      Need Storage? <https://copy.com?r=uQUfwT> | Zero Your Inbox
<https://mailstrom.co/referral/ARZJE> | Cloud Servers
<https://www.digitalocean.com/?refcode=97eeea09917a>

----------------------------------------------------------

  *Disclaimer:*

This e-mail is intended solely for the person to whom it is addressed and
may contain confidential or legally privileged information. Access to this
e-mail by anyone else is unauthorized. If an addressing or transmission
error has misdirected this e-mail, please notify the author by replying to
this e-mail and destroy this e-mail and any attachments.
E-mail may be susceptible to data corruption, interception, unauthorized
amendment, viruses and delays or the consequences thereof. If you are not
the intended recipient, be advised that you have received this email in
error and that any use, dissemination, forwarding, printing or copying of
this email is strictly prohibited.

**Comment by rperre** [comment]
I could do a tcpdump of the CURL debug if you want.

**Comment by rperre** [comment]
11:13:03.287439 IP6 localhost.60464 > localhost.radan-http: Flags [S], seq 2428928008, win 65476, options [mss 65476,sackOK,TS val 1557171 ecr 0,nop,wscale 6], length 0
11:13:03.287474 IP6 localhost.radan-http > localhost.60464: Flags [R.], seq 0, ack 2428928009, win 0, length 0
11:13:03.288018 IP myhost.com.48322 > myhost.com.radan-http: Flags [S], seq 3369957947, win 65495, options [mss 65495,sackOK,TS val 1557172 ecr 0,nop,wscale 6], length 0
11:13:03.288044 IP myhost.com.radan-http > myhost.com.48322: Flags [S.], seq 1069093212, ack 3369957948, win 65483, options [mss 65495,sackOK,TS val 1557172 ecr 1557172,nop,wscale 6], length 0
11:13:03.288337 IP myhost.com.radan-http > myhost.com.48322: Flags [.], ack 254, win 1040, options [nop,nop,TS val 1557172 ecr 1557172], length 0
11:13:03.289544 IP myhost.com.radan-http > myhost.com.48322: Flags [P.], seq 1:176, ack 254, win 1040, options [nop,nop,TS val 1557174 ecr 1557172], length 175
11:13:03.289795 IP myhost.com.radan-http > myhost.com.48322: Flags [P.], seq 176:214, ack 254, win 1040, options [nop,nop,TS val 1557174 ecr 1557174], length 38
11:13:03.291485 IP myhost.com.radan-http > myhost.com.48322: Flags [F.], seq 214, ack 255, win 1040, options [nop,nop,TS val 1557175 ecr 1557174], length 0
11:13:03.291518 IP myhost.com.48322 > myhost.com.radan-http: Flags [.], ack 215, win 1041, options [nop,nop,TS val 1557176 ecr 1557175], length 0

**Comment by rperre** [comment]
Is this what you wanted?

**Comment by greenfieldtech-nirs** [comment]
No,

  Try using ngrep, or simply tcpdump to a file and send the file to me - or
upload to some public cloud.

**Comment by rperre** [comment]
I've solved the problem!
Asterisk couldn't write on /var/spool/asterisk/recording
It was a permission problem, so I changed the ownership of this folder and now my recordings work fine.

**Comment by greenfieldtech-nirs** [comment]
I see - so please close the ticket

Kind Regards,

  Nir Simionovich
